{"schema":"daee-cross-model-paired-cycle-v1","kind":"paired-cycle-manifest","parent_cycle_id":"deterministic-fake-parent","post_completion_opus_authorization":"ffffffffffffffffffffffffffffffffffffffffffffffffffffffffffffffff","gpt_candidate":{"candidate_id":"fake-gpt-sibling","source_commit":"aaaaaaaaaaaaaaaaaaaaaaaaaaaaaaaaaaaaaaaa","package_sha256":"bbbbbbbbbbbbbbbbbbbbbbbbbbbbbbbbbbbbbbbbbbbbbbbbbbbbbbbbbbbbbbbb","archive_sha256":"cccccccccccccccccccccccccccccccccccccccccccccccccccccccccccccccc","extracted_tree_sha256":"dddddddddddddddddddddddddddddddddddddddddddddddddddddddddddddddd","build_manifest_sha256":"eeeeeeeeeeeeeeeeeeeeeeeeeeeeeeeeeeeeeeeeeeeeeeeeeeeeeeeeeeeeeeee","registry_sha256":"ca0bae038af7aa350cadc82cf2f807e5d6761c6cf38b913d03079cf891ac73a1"},"opus_candidate":{"candidate_id":"fake-opus-sibling","source_commit":"aaaaaaaaaaaaaaaaaaaaaaaaaaaaaaaaaaaaaaaa","package_sha256":"bbbbbbbbbbbbbbbbbbbbbbbbbbbbbbbbbbbbbbbbbbbbbbbbbbbbbbbbbbbbbbbb","archive_sha256":"cccccccccccccccccccccccccccccccccccccccccccccccccccccccccccccccc","extracted_tree_sha256":"dddddddddddddddddddddddddddddddddddddddddddddddddddddddddddddddd","build_manifest_sha256":"eeeeeeeeeeeeeeeeeeeeeeeeeeeeeeeeeeeeeeeeeeeeeeeeeeeeeeeeeeeeeeee","registry_sha256":"ca0bae038af7aa350cadc82cf2f807e5d6761c6cf38b913d03079cf891ac73a1"},"gpt_rows":[{"row_id":"g0","model_family":"GPT","case_id":"gate88-secularism","worker":"g0","candidate_id":"fake-gpt-sibling"},{"row_id":"g1","model_family":"GPT","case_id":"gate88-khaybar","worker":"g1","candidate_id":"fake-gpt-sibling"},{"row_id":"g2","model_family":"GPT","case_id":"gate88-trinitarian-j173","worker":"g2","candidate_id":"fake-gpt-sibling"},{"row_id":"g3","model_family":"GPT","case_id":"gate88-tst-lillard","worker":"g3","candidate_id":"fake-gpt-sibling"},{"row_id":"g4","model_family":"GPT","case_id":"gate88-torah-quran-source-authentication","worker":"g4","candidate_id":"fake-gpt-sibling"}],"opus_rows":[{"row_id":"o0","model_family":"OPUS","case_id":"gate88-secularism","worker":"o0","candidate_id":"fake-opus-sibling"},{"row_id":"o1","model_family":"OPUS","case_id":"gate88-khaybar","worker":"o1","candidate_id":"fake-opus-sibling"},{"row_id":"o2","model_family":"OPUS","case_id":"gate88-trinitarian-j173","worker":"o2","candidate_id":"fake-opus-sibling"},{"row_id":"o3","model_family":"OPUS","case_id":"gate88-tst-lillard","worker":"o3","candidate_id":"fake-opus-sibling"},{"row_id":"o4","model_family":"OPUS","case_id":"gate88-torah-quran-source-authentication","worker":"o4","candidate_id":"fake-opus-sibling"}],"pass_carry_forward":false,"root_recurrences":[],"dispatch_manifest":{"protocol":"barrier-ten-submit-before-await-v1","expected_workers":10,"workers":[{"worker":"g0","case_id":"gate88-secularism","model_family":"GPT","home":"homes/g0","cache":"caches/g0","run_root":"runs/g0"},{"worker":"g1","case_id":"gate88-khaybar","model_family":"GPT","home":"homes/g1","cache":"caches/g1","run_root":"runs/g1"},{"worker":"g2","case_id":"gate88-trinitarian-j173","model_family":"GPT","home":"homes/g2","cache":"caches/g2","run_root":"runs/g2"},{"worker":"g3","case_id":"gate88-tst-lillard","model_family":"GPT","home":"homes/g3","cache":"caches/g3","run_root":"runs/g3"},{"worker":"g4","case_id":"gate88-torah-quran-source-authentication","model_family":"GPT","home":"homes/g4","cache":"caches/g4","run_root":"runs/g4"},{"worker":"o0","case_id":"gate88-secularism","model_family":"OPUS","home":"homes/o0","cache":"caches/o0","run_root":"runs/o0"},{"worker":"o1","case_id":"gate88-khaybar","model_family":"OPUS","home":"homes/o1","cache":"caches/o1","run_root":"runs/o1"},{"worker":"o2","case_id":"gate88-trinitarian-j173","model_family":"OPUS","home":"homes/o2","cache":"caches/o2","run_root":"runs/o2"},{"worker":"o3","case_id":"gate88-tst-lillard","model_family":"OPUS","home":"homes/o3","cache":"caches/o3","run_root":"runs/o3"},{"worker":"o4","case_id":"gate88-torah-quran-source-authentication","model_family":"OPUS","home":"homes/o4","cache":"caches/o4","run_root":"runs/o4"}],"events":[{"event":"worker_ready","worker":"g0","case_id":"gate88-secularism","model_family":"GPT","sequence":1,"predecessor_event_sha256":null,"event_sha256":"650d06dfc7531563362db74d5c600725d1f0e4ce2eb0c91e0e227475f1f7ffa8"},{"event":"worker_ready","worker":"g1","case_id":"gate88-khaybar","model_family":"GPT","sequence":2,"predecessor_event_sha256":"650d06dfc7531563362db74d5c600725d1f0e4ce2eb0c91e0e227475f1f7ffa8","event_sha256":"86e02ce509b45976501f47337b6c84b4c2e560e2ba7ac9e0e859860ebee9433c"},{"event":"worker_ready","worker":"g2","case_id":"gate88-trinitarian-j173","model_family":"GPT","sequence":3,"predecessor_event_sha256":"86e02ce509b45976501f47337b6c84b4c2e560e2ba7ac9e0e859860ebee9433c","event_sha256":"7c1efc919eb821a32b01e3fe736d256030196004d1edbeac6b13929ebe8af14a"},{"event":"worker_ready","worker":"g3","case_id":"gate88-tst-lillard","model_family":"GPT","sequence":4,"predecessor_event_sha256":"7c1efc919eb821a32b01e3fe736d256030196004d1edbeac6b13929ebe8af14a","event_sha256":"d02b02684318b94b83398378fa684b81128eb970daa07d941998dac9cb206520"},{"event":"worker_ready","worker":"g4","case_id":"gate88-torah-quran-source-authentication","model_family":"GPT","sequence":5,"predecessor_event_sha256":"d02b02684318b94b83398378fa684b81128eb970daa07d941998dac9cb206520","event_sha256":"9da3d5b56a55fa6b77a08a9922fe501129658e8fef85b7b91b7e1896425b4cef"},{"event":"worker_ready","worker":"o0","case_id":"gate88-secularism","model_family":"OPUS","sequence":6,"predecessor_event_sha256":"9da3d5b56a55fa6b77a08a9922fe501129658e8fef85b7b91b7e1896425b4cef","event_sha256":"d7bf6c5a3ccd7a8659c7ec0e097ff6101b4767713b856d62a6a78befab635547"},{"event":"worker_ready","worker":"o1","case_id":"gate88-khaybar","model_family":"OPUS","sequence":7,"predecessor_event_sha256":"d7bf6c5a3ccd7a8659c7ec0e097ff6101b4767713b856d62a6a78befab635547","event_sha256":"40fa3a2f24858f78057dea8b51c8dbd685291ae7e9e83566b4b56cc1e8137332"},{"event":"worker_ready","worker":"o2","case_id":"gate88-trinitarian-j173","model_family":"OPUS","sequence":8,"predecessor_event_sha256":"40fa3a2f24858f78057dea8b51c8dbd685291ae7e9e83566b4b56cc1e8137332","event_sha256":"316dd42ace6c518c43b38fd833e889cec6782b66a958557ceaa484587fba4cd8"},{"event":"worker_ready","worker":"o3","case_id":"gate88-tst-lillard","model_family":"OPUS","sequence":9,"predecessor_event_sha256":"316dd42ace6c518c43b38fd833e889cec6782b66a958557ceaa484587fba4cd8","event_sha256":"269cbfddaf267e4bf4130914e1f9643a7eb2c2fe991d72f3586a086da54d449c"},{"event":"worker_ready","worker":"o4","case_id":"gate88-torah-quran-source-authentication","model_family":"OPUS","sequence":10,"predecessor_event_sha256":"269cbfddaf267e4bf4130914e1f9643a7eb2c2fe991d72f3586a086da54d449c","event_sha256":"c7f946b6cb6520ebd117b528989cd99cdff6dedef8606b7733f542e70eaf08f4"},{"event":"barrier_release","sequence":11,"predecessor_event_sha256":"c7f946b6cb6520ebd117b528989cd99cdff6dedef8606b7733f542e70eaf08f4","event_sha256":"46e5848a817ecb35aa205575bc7d67cbd9a26a7d86354139851539944a9b5c55"},{"event":"request_submit_started","worker":"g0","case_id":"gate88-secularism","model_family":"GPT","sequence":12,"predecessor_event_sha256":"46e5848a817ecb35aa205575bc7d67cbd9a26a7d86354139851539944a9b5c55","event_sha256":"05f84a68fdb5bbdaee0a55c46db42b42f31c3ef0368e7f1707159d45f966594c"},{"event":"call_entered_in_flight","worker":"g0","case_id":"gate88-secularism","model_family":"GPT","sequence":13,"predecessor_event_sha256":"05f84a68fdb5bbdaee0a55c46db42b42f31c3ef0368e7f1707159d45f966594c","event_sha256":"7f937b4fc0defd6ae0adeab47dd02252888eb18e05e45625ef98ae9385a826b5"},{"event":"request_submit_started","worker":"g1","case_id":"gate88-khaybar","model_family":"GPT","sequence":14,"predecessor_event_sha256":"7f937b4fc0defd6ae0adeab47dd02252888eb18e05e45625ef98ae9385a826b5","event_sha256":"41d74b27e85b2e1bf86ff0ea46648c5a33c833339aed904a6c8d1f6858ebfdfd"},{"event":"call_entered_in_flight","worker":"g1","case_id":"gate88-khaybar","model_family":"GPT","sequence":15,"predecessor_event_sha256":"41d74b27e85b2e1bf86ff0ea46648c5a33c833339aed904a6c8d1f6858ebfdfd","event_sha256":"42e0617d153479c516de2385bf69888120aaf9cc5e9af595db505f42f2b8eb8f"},{"event":"request_submit_started","worker":"g2","case_id":"gate88-trinitarian-j173","model_family":"GPT","sequence":16,"predecessor_event_sha256":"42e0617d153479c516de2385bf69888120aaf9cc5e9af595db505f42f2b8eb8f","event_sha256":"cc127009eb8597d7d97766427d4f4aa802ee9f89fef59a3add2ed2220179eb4d"},{"event":"call_entered_in_flight","worker":"g2","case_id":"gate88-trinitarian-j173","model_family":"GPT","sequence":17,"predecessor_event_sha256":"cc127009eb8597d7d97766427d4f4aa802ee9f89fef59a3add2ed2220179eb4d","event_sha256":"47e1577e4f457a933d06137ade995f4ad60736b52a3d597602e7d071858ccda7"},{"event":"request_submit_started","worker":"g3","case_id":"gate88-tst-lillard","model_family":"GPT","sequence":18,"predecessor_event_sha256":"47e1577e4f457a933d06137ade995f4ad60736b52a3d597602e7d071858ccda7","event_sha256":"7ba182dba0e454acbf6a67dffa179e50b8123efe75b0a98004b1ad6102a72ed3"},{"event":"call_entered_in_flight","worker":"g3","case_id":"gate88-tst-lillard","model_family":"GPT","sequence":19,"predecessor_event_sha256":"7ba182dba0e454acbf6a67dffa179e50b8123efe75b0a98004b1ad6102a72ed3","event_sha256":"23492bf1b6adf79dc32f96982f905f75e08223c8dbad9daa3e57bc331554b86a"},{"event":"request_submit_started","worker":"g4","case_id":"gate88-torah-quran-source-authentication","model_family":"GPT","sequence":20,"predecessor_event_sha256":"23492bf1b6adf79dc32f96982f905f75e08223c8dbad9daa3e57bc331554b86a","event_sha256":"f82704fde5b179c6769155563efa3eac636ec1c465576e50286de81c513987ee"},{"event":"call_entered_in_flight","worker":"g4","case_id":"gate88-torah-quran-source-authentication","model_family":"GPT","sequence":21,"predecessor_event_sha256":"f82704fde5b179c6769155563efa3eac636ec1c465576e50286de81c513987ee","event_sha256":"65eeeb3f685a22c69b58dd1b286bf1df4f1fb7db5cd0dd145b8576c34e0cc962"